code,id,name,parent_id/id,type,user_type,reconcile
624900,624900,ค่ารักษาความปลอดภัย,624000,Regular,Expense,0
624910,621910,ค่าบริการรักษาความสะอาด,624000,Regular,Expense,0
625000,625000,ค่าโทรศัพท์และการสื่อสาร,620000,View,View,0
625100,625100,ค่าโทรศัพท์,625000,Regular,Expense,0
625200,625200,ค่าอินเตอร์เน็ต,625000,Regular,Expense,0
626000,626000,ค่าซ่อมแซมบำรุงรักษา,620000,View,View,0
626200,626200,ค่าซ่อมบำรุงเครื่องใช้สำนักงาน-office,626000,Regular,Expense,0
626300,626300,ค่าซ่อมบำรุงยานพาหนะ,626000,Regular,Expense,0
627000,627000,ค่าธรรมเนียมธนาคารและอื่นๆ,620000,View,View,0
627100,627100,ค่าธรรมเนียมต่าง ๆ,627000,Regular,Expense,0
627200,627200,ค่าธรรมเนียมธนาคาร,627000,Regular,Expense,0
627300,627300,ค่าธรรมเนียมใบอนุญาติ,627000,Regular,Expense,0
628000,628000,ค่าเบี้ยประกันภัยต่างๆ,620000,View,View,0
628100,628100,ค่าเบี้ยประกันรถยนต์,628000,Regular,Expense,0
628200,628200,ค่าเบี้ยประกันอัคคีภัย,628000,Regular,Expense,0
628300,628300,ค่าเบี้ยประกันอื่น,628000,Regular,Expense,0
629000,629000,ค่าพาหนะและค่าใช้จ่ายเดินทาง,620000,View,View,0
629100,629100,ค่าพาหนะ (ค่าน้ำมัน ค่าทางด่วน),629000,Regular,Expense,0
629200,629200,ค่าใช้จ่ายในการเดินทาง (ค่าที่พัก. ค่าอาหาร),629000,Regular,Expense,0
629300,629300,ค่าพาหนะ (ผู้บริหาร),629000,Regular,Expense,0
629300,629300,ค่าขนส่ง,628000,View,View,0
629400,629400,ค่าใช้จ่ายในการส่งออก,629300,Regular,Expense,0
629500,629500,ค่าเบี้ยปรับ,629300,Regular,Expense,0
629600,629600,ค่าขนส่ง,629300,Regular,Expense,0
641000,641000,ค่าสินไหมทดแทน,628000,View,View,0
641100,641100,ค่าสินไหมทดแทน,641000,Regular,Expense,0
641200,641200,ค่าเคลมสินค้า,641000,Regular,Expense,0
651000,651000,ค่าใช้จ่ายการในการดำเนินงานอื่นๆ,600000,View,View,0
651100,651100,เงินทุนสำรอง,651000,Regular,Expense,0
651200,651200,หนี้สูญ,651000,Regular,Expense,0
651300,651300,ค่าการกุศล,651000,Regular,Expense,0
651400,651400,เงินบริจาค,651000,Regular,Expense,0
651500,651500,สวัสดิการสังคม,651000,Regular,Expense,0
651600,651600,ค่ารับรอง,651000,Regular,Expense,0
651700,651700,ค่า-COMMISSION,651000,Regular,Expense,0
651800,651800,ค่าประเมินราคา,651000,Regular,Expense,0
661000,661000,ค่าเสื่อมราคาและการตัดจำหน่าย,600000,View,View,0
661100,661100,ค่าเสื่อมราคา - เครื่องใช้สำนักงาน- office,661000,Regular,Expense,0
661600,661600,ค่าเสื่อมราคา-ยานพาหนะ,661000,Regular,Expense,0
661700,661700,ค่าใช้จ่ายตัดจำหน่ายทรัพย์สิน,661000,Regular,Expense,0
671000,671000,ค่าใช้จ่ายทางการเงิน,661000,View,View,0
671100,671100,ดอกเบี้ยเงินกู้,671000,Regular,Expense,0
671200,671200,ดอกเบี้ยเงินเบิกเกินบัญชี,671000,Regular,Expense,0
671300,671300,ดอกเบี้ยตั๋วสัญญาใช้เงิน,671000,Regular,Expense,0
681000,681000,ค่าใช้จ่ายบวกกลับ,600000,View,View,0
681100,681100,ค่าใช้จ่ายไม่ให้ถือเป็นรายจ่าย,681000,Regular,Expense,0
681200,681200,เบี้ยปรับเงินเพิ่มตามประมวลรัษฎากร,681000,Regular,Expense,0
681300,681300,บัญชีพัก,681000,Regular,Expense,0
691000,691000,ภาษีเงินได้นิติบุคคล,600000,View,View,0
691100,691100,ภาษีเงินได้นิติบุคคล,691000,Regular,Expense,0